{
  "schema_version": "0.5",
  "run_id": "buggy_cancel",
  "agent": { "name": "support-agent", "version": "1.4" },
  "task": { "id": "refund-001", "input": "Cancel my latest order" },
  "trace": [
    {
      "span_id": "s1",
      "name": "cancel_order",
      "type": "tool",
      "start_time": "2026-01-01T00:00:00Z",
      "end_time": "2026-01-01T00:00:00.010Z",
      "attributes": {
        "input": { "order_id": 122 },
        "output": { "ok": true }
      },
      "status": { "code": "ok" }
    }
  ],
  "outcome": {
    "status": "completed",
    "output": "Cancelled delivered order by mistake."
  }
}
